{
  "schema_version": "1.0.0-draft.3",
  "task_id": "plotter_circle_llm10",
  "task_goal": "三轴绘图单元在 XY 平面绘制整圆：run 使能三轴驱动器后，按 cmd_draw 启动序列——先确认抬笔（z_fb=10），XY 定位至圆起点（圆心 50%,50%，半径 25%，起点 (50,25)），落笔（z_fb→0），X/Y 双轴速度插补沿圆周运动一整圈回到起点，抬笔，XY 返回圆心 (50,50)，点亮 plot_done。急停/任一驱动器故障时受控减速并中止绘制，plot_done 熄灭，需 cmd_reset 复位。PLC 写速度指令 x_v/y_v/z_v 与状态灯，伺服侧仿真电机执行，NC 通过 x_sp/y_sp/z_sp 通道给出定位目标。",
  "io_list": [
    {
      "name": "run",
      "dir": "input",
      "type": "BOOL",
      "range": null,
      "device": "驱动使能主令开关（安全回路就绪后允许三轴驱动器上电；断开=受控断电；绘圆序列同样以 run=1 为前置条件）"
    },
    {
      "name": "cmd_home",
      "dir": "input",
      "type": "BOOL",
      "range": null,
      "device": "回参考点按钮（Z 参考点=抬笔安全位）"
    },
    {
      "name": "cmd_go",
      "dir": "input",
      "type": "BOOL",
      "range": null,
      "device": "手动定位启动按钮（目标位置由 NC 设定值通道给出；落笔状态下 X/Y 请求被安全互锁拒绝）"
    },
    {
      "name": "jog_fwd",
      "dir": "input",
      "type": "BOOL",
      "range": null,
      "device": "X 轴手动进给正向按钮（电平有效，仅抬笔状态允许）"
    },
    {
      "name": "jog_rev",
      "dir": "input",
      "type": "BOOL",
      "range": null,
      "device": "X 轴手动进给反向按钮（电平有效，仅抬笔状态允许）"
    },
    {
      "name": "quickstop",
      "dir": "input",
      "type": "BOOL",
      "range": null,
      "device": "急停（安全继电器触点，电平有效；受控减速并中止绘圆，plot_done 置 0）"
    },
    {
      "name": "cmd_reset",
      "dir": "input",
      "type": "BOOL",
      "range": null,
      "device": "故障复位按钮"
    },
    {
      "name": "cmd_draw",
      "dir": "input",
      "type": "BOOL",
      "range": null,
      "device": "绘图启动按钮（抬笔→定位圆起点 (50,25)→落笔沿圆心 (50,50) 半径 25% 整圆插补→抬笔→回圆心）"
    },
    {
      "name": "all_oe",
      "dir": "output",
      "type": "BOOL",
      "range": null,
      "device": "就绪指示灯（三轴驱动器全部使能）"
    },
    {
      "name": "move_done",
      "dir": "output",
      "type": "BOOL",
      "range": null,
      "device": "定位完成指示灯（手动定位完成汇总；绘圆序列期间熄灭）"
    },
    {
      "name": "any_moving",
      "dir": "output",
      "type": "BOOL",
      "range": null,
      "device": "运动中指示灯（任一轴速度指令非零）"
    },
    {
      "name": "fault_any",
      "dir": "output",
      "type": "BOOL",
      "range": null,
      "device": "故障指示灯（任一驱动器故障位）"
    },
    {
      "name": "pen_down",
      "dir": "output",
      "type": "BOOL",
      "range": null,
      "device": "笔触纸指示灯（Z 行程下限区，含入场容差；绘圆期间应保持点亮）"
    },
    {
      "name": "plot_done",
      "dir": "output",
      "type": "BOOL",
      "range": null,
      "device": "绘图完成指示灯（抬笔回圆心后点亮；急停/故障中止时熄灭）"
    },
    {
      "name": "x_fb",
      "dir": "input",
      "type": "INT",
      "range": [
        0,
        100
      ],
      "device": "X 轴位置反馈（编码器当量）",
      "unit": "%"
    },
    {
      "name": "y_fb",
      "dir": "input",
      "type": "INT",
      "range": [
        0,
        100
      ],
      "device": "Y 轴位置反馈（编码器当量）",
      "unit": "%"
    },
    {
      "name": "z_fb",
      "dir": "input",
      "type": "INT",
      "range": [
        0,
        10
      ],
      "device": "Z 轴笔位反馈（0=笔尖触纸，10=抬笔）",
      "unit": "mm"
    },
    {
      "name": "x_sp",
      "dir": "input",
      "type": "INT",
      "range": [
        0,
        100
      ],
      "device": "X 轴定位设定值（NC 写入，先于定位启动建立；绘圆起点 X=50）",
      "unit": "%"
    },
    {
      "name": "y_sp",
      "dir": "input",
      "type": "INT",
      "range": [
        0,
        100
      ],
      "device": "Y 轴定位设定值（NC 写入；绘圆起点 Y=25）",
      "unit": "%"
    },
    {
      "name": "z_sp",
      "dir": "input",
      "type": "INT",
      "range": [
        0,
        10
      ],
      "device": "Z 轴笔位设定值（手动抬/落笔；不受笔互锁限制）",
      "unit": "mm"
    },
    {
      "name": "x_sw",
      "dir": "output",
      "type": "INT",
      "range": [
        0,
        65535
      ],
      "device": "X 驱动器状态字（诊断通道；bit3=故障，bit10=到位）"
    },
    {
      "name": "y_sw",
      "dir": "output",
      "type": "INT",
      "range": [
        0,
        65535
      ],
      "device": "Y 驱动器状态字（诊断通道）"
    },
    {
      "name": "z_sw",
      "dir": "output",
      "type": "INT",
      "range": [
        0,
        65535
      ],
      "device": "Z 驱动器状态字（诊断通道）"
    },
    {
      "name": "x_v",
      "dir": "output",
      "type": "INT",
      "range": [
        -120,
        120
      ],
      "device": "X 轴速度指令（伺服驱动器给定，带符号；绘圆圆弧插补正弦分量）",
      "unit": "%/s"
    },
    {
      "name": "y_v",
      "dir": "output",
      "type": "INT",
      "range": [
        -120,
        120
      ],
      "device": "Y 轴速度指令（伺服驱动器给定，带符号；绘圆圆弧插补余弦分量）",
      "unit": "%/s"
    },
    {
      "name": "z_v",
      "dir": "output",
      "type": "INT",
      "range": [
        -120,
        120
      ],
      "device": "Z 轴速度指令（伺服驱动器给定，带符号；轴组态限速 20）",
      "unit": "mm/s"
    }
  ],
  "constraints": [
    {
      "id": "C1",
      "kind": "interlock",
      "desc": "急停安全联锁：quickstop=1 期间，X/Y/Z 速度指令必须归零（x_v=0, y_v=0, z_v=0），受控减速后绘圆序列中止，plot_done 保持熄灭，直至 cmd_reset 复位。"
    },
    {
      "id": "C2",
      "kind": "interlock",
      "desc": "笔位安全联锁：pen_down=1（z_fb≤1，笔触纸）期间，禁止响应 jog_fwd/jog_rev 手动进给与 cmd_go 手动定位请求，仅绘圆插补运动不受此互锁限制。"
    },
    {
      "id": "C3",
      "kind": "interlock",
      "desc": "使能联锁：run=0 时三轴驱动器不上电，all_oe=0，任何运动指令（含 cmd_draw）无效；run 断开瞬间执行受控减速。"
    },
    {
      "id": "C4",
      "kind": "exception",
      "desc": "任一驱动器故障（x_sw/y_sw/z_sw bit3=1）时 fault_any=1，立即停止速度指令输出，绘圆序列中止；需 cmd_reset 且故障消除后方可重新启动。"
    },
    {
      "id": "C5",
      "kind": "timing",
      "desc": "绘圆主时序：cmd_draw 上升沿→确认抬笔（z_fb=10）→XY 定位至圆起点 (50,25)（到位判据 POSWIN=2%）→Z 落笔至 0（POSWIN=1mm）→圆弧插补一周（圆心 (50,50)，半径 25%，切向速度限 40%/s，加减速 80%/s²）→抬笔至 10→回圆心 (50,50)→plot_done=1。"
    },
    {
      "id": "C6",
      "kind": "timing",
      "desc": "绘圆期间 move_done 熄灭，any_moving 随速度指令非零点亮；plot_done 仅在最终抬笔回中心完成后置 1 并保持。"
    }
  ],
  "acceptance": [
    {
      "id": "AC1",
      "desc": "绘圆序列总时间（cmd_draw 上升沿→plot_done 上升沿）不超过 30s（含定位、落笔、整圆插补、抬笔、回中心，估算约 12s，放宽裕量）。",
      "type": "event_delay",
      "from": {
        "signal": "cmd_draw",
        "edge": "rising"
      },
      "to": {
        "signal": "plot_done",
        "edge": "rising"
      },
      "op": "<=",
      "value": 30.0,
      "unit": "s"
    },
    {
      "id": "AC2",
      "desc": "急停期间禁止运动：quickstop=1 时不得有任何轴处于运动状态。",
      "type": "forbidden_state",
      "when": {
        "signal": "quickstop",
        "equals": 1
      },
      "forbid": {
        "signal": "any_moving",
        "equals": 1
      }
    },
    {
      "id": "AC3",
      "desc": "急停期间 X 轴速度指令必须为零。",
      "type": "forbidden_state",
      "when": {
        "signal": "quickstop",
        "equals": 1
      },
      "forbid": {
        "signal": "x_v",
        "equals": 40
      }
    },
    {
      "id": "AC4",
      "desc": "急停期间 Y 轴速度指令必须为零。",
      "type": "forbidden_state",
      "when": {
        "signal": "quickstop",
        "equals": 1
      },
      "forbid": {
        "signal": "y_v",
        "equals": 40
      }
    },
    {
      "id": "AC5",
      "desc": "落笔状态下禁止手动定位：pen_down=1 时 cmd_go 触发不得产生 X 轴运动。",
      "type": "forbidden_state",
      "when": {
        "signal": "pen_down",
        "equals": 1
      },
      "forbid": {
        "signal": "x_v",
        "equals": 40
      }
    },
    {
      "id": "AC6",
      "desc": "绘圆序列终点：抬笔回到圆心，X 位置在圆心 50% 的容差带内（容差取 POSWIN=2% 的 2.5 倍）。",
      "type": "region_containment",
      "asset": "Plotter3Axis",
      "region_center": [
        50,
        50,
        10
      ],
      "tolerance": 5.0,
      "check_at": "end"
    },
    {
      "id": "AC7",
      "desc": "绘圆全过程中各轴位置不越界（x_fb/y_fb 保持 0..100，圆路径最小/最大 25/75），仿真无发散，速度指令幅值不超过轴限速。",
      "type": "sim_health"
    }
  ]
}