{
  "schema_version": "1.0.0-draft.3",
  "task_id": "plotter_ci_learn7",
  "task_goal": "三轴绘图机在 100×100 绘图平面内绘制整圆：圆心 (50,50)、半径 25。工艺序列为：run 使能且三轴驱动器就绪后，按 cmd_draw 启动——Z 轴先回抬笔安全位（z=10mm），X/Y 抬笔快移定位至圆周起点 (50,25)，Z 轴落笔至触纸位（z=0mm），随后沿 24 段等分折线顺时针（角度步进 15°）插补绘制整圆并回到起点闭合，落笔段间插补速度受限且逐点到位（POSWIN 内），画毕抬笔（z=10mm）并回圆心 (50,50)，点亮 plot_done。急停或任一轴故障时受控减速并中止绘图，plot_done 熄灭。PLC 通过 x_v/y_v/z_v 速度指令驱动仿真电机，经 x_fb/y_fb/z_fb 反馈闭环到位判据。",
  "io_list": [
    {
      "name": "run",
      "dir": "input",
      "type": "BOOL",
      "range": null,
      "device": "驱动使能主令开关（安全回路就绪后允许三轴驱动器上电；断开=受控断电）"
    },
    {
      "name": "cmd_home",
      "dir": "input",
      "type": "BOOL",
      "range": null,
      "device": "回参考点按钮（Z 参考点=抬笔安全位）"
    },
    {
      "name": "cmd_go",
      "dir": "input",
      "type": "BOOL",
      "range": null,
      "device": "手动定位启动按钮（目标位置由 NC 设定值通道给出；落笔状态下 X/Y 请求被安全互锁拒绝）"
    },
    {
      "name": "jog_fwd",
      "dir": "input",
      "type": "BOOL",
      "range": null,
      "device": "X 轴手动进给正向按钮（电平有效，仅抬笔状态允许）"
    },
    {
      "name": "jog_rev",
      "dir": "input",
      "type": "BOOL",
      "range": null,
      "device": "X 轴手动进给反向按钮（电平有效，仅抬笔状态允许）"
    },
    {
      "name": "quickstop",
      "dir": "input",
      "type": "BOOL",
      "range": null,
      "device": "急停（安全继电器触点，电平有效；受控减速并中止绘图）"
    },
    {
      "name": "cmd_reset",
      "dir": "input",
      "type": "BOOL",
      "range": null,
      "device": "故障复位按钮"
    },
    {
      "name": "cmd_draw",
      "dir": "input",
      "type": "BOOL",
      "range": null,
      "device": "绘图启动按钮（本任务改写为：抬笔→定位圆周起点 (50,25)→落笔沿 24 段折线画整圆闭合→抬笔→回圆心 (50,50,10)）"
    },
    {
      "name": "all_oe",
      "dir": "output",
      "type": "BOOL",
      "range": null,
      "device": "就绪指示灯（三轴驱动器全部使能）"
    },
    {
      "name": "move_done",
      "dir": "output",
      "type": "BOOL",
      "range": null,
      "device": "定位完成指示灯（手动定位完成汇总；绘图序列期间熄灭）"
    },
    {
      "name": "any_moving",
      "dir": "output",
      "type": "BOOL",
      "range": null,
      "device": "运动中指示灯（任一轴速度指令非零）"
    },
    {
      "name": "fault_any",
      "dir": "output",
      "type": "BOOL",
      "range": null,
      "device": "故障指示灯（任一驱动器故障位）"
    },
    {
      "name": "pen_down",
      "dir": "output",
      "type": "BOOL",
      "range": null,
      "device": "笔触纸指示灯（Z 行程下限区，含入场容差）"
    },
    {
      "name": "plot_done",
      "dir": "output",
      "type": "BOOL",
      "range": null,
      "device": "绘图完成指示灯（整圆绘制完成且抬笔回圆心后点亮；急停/故障中止时熄灭）"
    },
    {
      "name": "x_fb",
      "dir": "input",
      "type": "INT",
      "range": [
        0,
        100
      ],
      "device": "X 轴位置反馈（编码器当量）",
      "unit": "%"
    },
    {
      "name": "y_fb",
      "dir": "input",
      "type": "INT",
      "range": [
        0,
        100
      ],
      "device": "Y 轴位置反馈（编码器当量）",
      "unit": "%"
    },
    {
      "name": "z_fb",
      "dir": "input",
      "type": "INT",
      "range": [
        0,
        10
      ],
      "device": "Z 轴笔位反馈（0=笔尖触纸，10=抬笔）",
      "unit": "mm"
    },
    {
      "name": "x_sp",
      "dir": "input",
      "type": "INT",
      "range": [
        0,
        100
      ],
      "device": "X 轴定位设定值（NC 写入，先于定位启动建立）",
      "unit": "%"
    },
    {
      "name": "y_sp",
      "dir": "input",
      "type": "INT",
      "range": [
        0,
        100
      ],
      "device": "Y 轴定位设定值（NC 写入）",
      "unit": "%"
    },
    {
      "name": "z_sp",
      "dir": "input",
      "type": "INT",
      "range": [
        0,
        10
      ],
      "device": "Z 轴笔位设定值（手动抬/落笔；不受笔互锁限制）",
      "unit": "mm"
    },
    {
      "name": "x_sw",
      "dir": "output",
      "type": "INT",
      "range": [
        0,
        65535
      ],
      "device": "X 驱动器状态字（诊断通道；bit3=故障，bit10=到位）"
    },
    {
      "name": "y_sw",
      "dir": "output",
      "type": "INT",
      "range": [
        0,
        65535
      ],
      "device": "Y 驱动器状态字（诊断通道）"
    },
    {
      "name": "z_sw",
      "dir": "output",
      "type": "INT",
      "range": [
        0,
        65535
      ],
      "device": "Z 驱动器状态字（诊断通道）"
    },
    {
      "name": "x_v",
      "dir": "output",
      "type": "INT",
      "range": [
        -120,
        120
      ],
      "device": "X 轴速度指令（伺服驱动器给定，带符号；轴组态限速 40）",
      "unit": "%/s"
    },
    {
      "name": "y_v",
      "dir": "output",
      "type": "INT",
      "range": [
        -120,
        120
      ],
      "device": "Y 轴速度指令（伺服驱动器给定，带符号；轴组态限速 40）",
      "unit": "%/s"
    },
    {
      "name": "z_v",
      "dir": "output",
      "type": "INT",
      "range": [
        -120,
        120
      ],
      "device": "Z 轴速度指令（伺服驱动器给定，带符号；轴组态限速 20）",
      "unit": "mm/s"
    }
  ],
  "constraints": [
    {
      "id": "C1",
      "kind": "interlock",
      "desc": "笔状态安全互锁：当 z_fb 处于落笔区（z_fb<=1，笔触纸）时，禁止执行 cmd_go 手动定位与 jog_fwd/jog_rev 手动进给引起的任何 X/Y 轴速度指令输出（x_v/y_v 必须保持 0），防止划伤纸面与断笔。"
    },
    {
      "id": "C2",
      "kind": "timing",
      "desc": "绘图序列时序：cmd_draw 上升沿后，必须先完成 Z 轴抬笔（z_fb 到达 10mm±1）才允许启动 X/Y 轴向圆周起点 (50,25) 的定位运动；定位到位（|x_fb-50|<=2 且 |y_fb-25|<=2）后才允许 Z 轴落笔（z_fb→0）；落笔到位后才允许开始 24 段折线插补。"
    },
    {
      "id": "C3",
      "kind": "timing",
      "desc": "整圆插补时序：落笔后依次经过 24 个折线顶点 k=1..24，顶点坐标为 (50+25·cos(15°·k), 50+25·sin(15°·k))，k=24 时回到起点 (50,25) 实现闭合；每段以受限插补速度运行并在 POSWIN 容差内判到位后再进入下一段；落笔段 X/Y 合成限速不超过 20 %/s（VMAX 的一半），保证折线轨迹贴合。"
    },
    {
      "id": "C4",
      "kind": "timing",
      "desc": "收尾时序：第 24 段闭合到位后，先抬笔（z_fb→10mm±1）再启动 X/Y 回圆心 (50,50) 的运动；两轴到位（|x_fb-50|<=2 且 |y_fb-50|<=2）后置位 plot_done。"
    },
    {
      "id": "C5",
      "kind": "exception",
      "desc": "急停处理：quickstop 有效期间，三轴以受控减速停止（速度指令归零），绘图序列中止并进入中止态，plot_done 保持熄灭；需 cmd_reset 复位后才可重新接受 cmd_draw。"
    },
    {
      "id": "C6",
      "kind": "exception",
      "desc": "故障处理：任一驱动器状态字故障位置位（如 x_sw bit3）时，fault_any 点亮，速度指令立即归零，绘图序列中止，plot_done 熄灭；经 cmd_reset 复位后重新从抬笔安全态开始。"
    },
    {
      "id": "C7",
      "kind": "interlock",
      "desc": "使能互锁：run 断开或 all_oe 未就绪期间，禁止任何绘图序列启动（cmd_draw 被拒绝），且进行中的序列受控停止。"
    }
  ],
  "acceptance": [
    {
      "id": "AC1",
      "desc": "cmd_draw 上升沿后应在 2.5s 内完成抬笔（pen_down 熄灭表示 Z 轴已离开触纸区、到达抬笔安全位）",
      "type": "event_delay",
      "from": {
        "signal": "cmd_draw",
        "edge": "rising"
      },
      "to": {
        "signal": "pen_down",
        "edge": "falling"
      },
      "op": "<=",
      "value": 2.5,
      "unit": "s"
    },
    {
      "id": "AC2",
      "desc": "绘图启动后，落笔（笔触纸）期间不得出现手动 X/Y 运动：笔触纸状态时 X 轴手动进给不得引起 X 轴运动指令",
      "type": "forbidden_state",
      "when": {
        "signal": "pen_down",
        "equals": 1
      },
      "forbid": {
        "signal": "jog_fwd",
        "equals": 1
      }
    },
    {
      "id": "AC3",
      "desc": "安全互锁：笔触纸期间手动定位请求不得被受理（互锁拒绝，非手动脉冲下的轴运动）",
      "type": "forbidden_state",
      "when": {
        "signal": "pen_down",
        "equals": 1
      },
      "forbid": {
        "signal": "cmd_go",
        "equals": 1
      }
    },
    {
      "id": "AC4",
      "desc": "急停互锁：急停有效期间禁止绘图完成指示",
      "type": "forbidden_state",
      "when": {
        "signal": "quickstop",
        "equals": 1
      },
      "forbid": {
        "signal": "plot_done",
        "equals": 1
      }
    },
    {
      "id": "AC5",
      "desc": "绘图周期时间预算：cmd_draw 上升沿到 plot_done 置位，行程估算（定位 62+抬落笔 20+整圆周长 157+回程 25，合计约 264 单位，落笔段限速 20、空移 40，含加减速与通信裕量放宽 30%）应在 30s 内完成",
      "type": "event_delay",
      "from": {
        "signal": "cmd_draw",
        "edge": "rising"
      },
      "to": {
        "signal": "plot_done",
        "edge": "rising"
      },
      "op": "<=",
      "value": 30,
      "unit": "s"
    },
    {
      "id": "AC6",
      "desc": "终态定位：绘图完成后笔架（X/Y）应回到圆心、笔抬起，容差覆盖伺服 POSWIN（2%）并留裕量",
      "type": "region_containment",
      "asset": "pen",
      "region_center": [
        50,
        50,
        10
      ],
      "tolerance": 3,
      "check_at": "end"
    },
    {
      "id": "AC7",
      "desc": "仿真健康：整个绘图过程中三轴仿真无发散，各轴行程不越界（x_fb/y_fb∈[0,100]、z_fb∈[0,10]），落笔段轨迹贴合 24 段折线圆（半径 25±3）",
      "type": "sim_health"
    }
  ],
  "prog_id": 3
}