{
  "schema_version": "1.0.0-draft.3",
  "task_id": "motion3axis_demo",
  "task_goal": "三轴龙门运动控制（CiA 402 驱动模型 + PLCopen MC API，纯 ST 自包含实现）：PLC 内嵌三台伺服驱动器模型（状态机 SOD/RTSO/SO/OE/QSA/FRA/FA、Profile Position 模式梯形速度规划、位置伺服环），对外暴露 MC 级应用接口（使能/回零/定位/点动/快停/故障注入与复位）与驱动级诊断（状态字/速度指令）；外部扮演主站与电机仿真（按速度指令积分编码器反馈）。目标越程触发故障反应，快停为受控减速。",
  "io_list": [
    {
      "name": "run",
      "dir": "input",
      "type": "BOOL",
      "range": null,
      "device": "MC_Power 总使能（低=shutdown 命令）",
      "address": "%QX0.0"
    },
    {
      "name": "cmd_home",
      "dir": "input",
      "type": "BOOL",
      "range": null,
      "device": "MC_Home 回零指令（上升沿）",
      "address": "%QX0.1"
    },
    {
      "name": "cmd_go",
      "dir": "input",
      "type": "BOOL",
      "range": null,
      "device": "MC_MoveAbsolute 三轴并发定位指令（上升沿）",
      "address": "%QX0.2"
    },
    {
      "name": "jog_fwd",
      "dir": "input",
      "type": "BOOL",
      "range": null,
      "device": "X 轴 MC_MoveJog 正向（电平）",
      "address": "%QX0.3"
    },
    {
      "name": "jog_rev",
      "dir": "input",
      "type": "BOOL",
      "range": null,
      "device": "X 轴 MC_MoveJog 反向（电平）",
      "address": "%QX0.4"
    },
    {
      "name": "quickstop",
      "dir": "input",
      "type": "BOOL",
      "range": null,
      "device": "MC_Stop 快停（电平，QSA 受控减速）",
      "address": "%QX0.5"
    },
    {
      "name": "cmd_reset",
      "dir": "input",
      "type": "BOOL",
      "range": null,
      "device": "MC_Reset 故障复位（上升沿）",
      "address": "%QX0.7"
    },
    {
      "name": "x_fb",
      "dir": "input",
      "type": "INT",
      "range": [
        0,
        100
      ],
      "unit": "%",
      "device": "X 轴编码器反馈（电机仿真写入）",
      "address": "%QW0"
    },
    {
      "name": "y_fb",
      "dir": "input",
      "type": "INT",
      "range": [
        0,
        100
      ],
      "unit": "%",
      "device": "Y 轴编码器反馈",
      "address": "%QW1"
    },
    {
      "name": "z_fb",
      "dir": "input",
      "type": "INT",
      "range": [
        0,
        100
      ],
      "unit": "%",
      "device": "Z 轴编码器反馈",
      "address": "%QW2"
    },
    {
      "name": "x_sp",
      "dir": "input",
      "type": "INT",
      "range": [
        0,
        100
      ],
      "unit": "%",
      "device": "X 轴目标位置（主站写，先于 cmd_go 建立）",
      "address": "%QW10"
    },
    {
      "name": "y_sp",
      "dir": "input",
      "type": "INT",
      "range": [
        0,
        100
      ],
      "unit": "%",
      "device": "Y 轴目标位置",
      "address": "%QW11"
    },
    {
      "name": "z_sp",
      "dir": "input",
      "type": "INT",
      "range": [
        0,
        100
      ],
      "unit": "%",
      "device": "Z 轴目标位置",
      "address": "%QW12"
    },
    {
      "name": "x_sw",
      "dir": "output",
      "type": "INT",
      "range": [
        0,
        65535
      ],
      "device": "X 驱动状态字（CiA 402 编码：bit0/1/2/3/4/5/6/10/12）",
      "address": "%QW6"
    },
    {
      "name": "y_sw",
      "dir": "output",
      "type": "INT",
      "range": [
        0,
        65535
      ],
      "device": "Y 驱动状态字",
      "address": "%QW7"
    },
    {
      "name": "z_sw",
      "dir": "output",
      "type": "INT",
      "range": [
        0,
        65535
      ],
      "device": "Z 驱动状态字",
      "address": "%QW8"
    },
    {
      "name": "x_v",
      "dir": "output",
      "type": "INT",
      "range": [
        -120,
        120
      ],
      "unit": "%/s",
      "device": "X 电机速度指令（带符号，伺服环输出）",
      "address": "%QW13"
    },
    {
      "name": "y_v",
      "dir": "output",
      "type": "INT",
      "range": [
        -120,
        120
      ],
      "unit": "%/s",
      "device": "Y 电机速度指令",
      "address": "%QW14"
    },
    {
      "name": "z_v",
      "dir": "output",
      "type": "INT",
      "range": [
        -120,
        120
      ],
      "unit": "%/s",
      "device": "Z 电机速度指令",
      "address": "%QW15"
    },
    {
      "name": "all_oe",
      "dir": "output",
      "type": "BOOL",
      "range": null,
      "device": "三轴全部 Operation Enabled",
      "address": "%QX1.0"
    },
    {
      "name": "move_done",
      "dir": "output",
      "type": "BOOL",
      "range": null,
      "device": "MC_MoveAbsolute 三轴 Done 汇总",
      "address": "%QX1.1"
    },
    {
      "name": "any_moving",
      "dir": "output",
      "type": "BOOL",
      "range": null,
      "device": "任一轴速度指令非零",
      "address": "%QX1.2"
    },
    {
      "name": "fault_any",
      "dir": "output",
      "type": "BOOL",
      "range": null,
      "device": "任一轴故障（sw bit3）",
      "address": "%QX1.3"
    },
    {
      "name": "cmd_halt",
      "dir": "input",
      "type": "BOOL",
      "range": null,
      "device": "MC_Halt 受控暂停指令（上升沿，减速停不失能）",
      "address": "%QX2.0"
    },
    {
      "name": "cmd_rel",
      "dir": "input",
      "type": "BOOL",
      "range": null,
      "device": "MC_MoveRelative 相对定位指令（上升沿）",
      "address": "%QX2.1"
    },
    {
      "name": "rel_x_d",
      "dir": "input",
      "type": "INT",
      "range": [
        -100,
        100
      ],
      "unit": "%",
      "device": "X 相对定位距离（触发时叠加实际位置）",
      "address": "%QW3"
    },
    {
      "name": "rel_y_d",
      "dir": "input",
      "type": "INT",
      "range": [
        -100,
        100
      ],
      "unit": "%",
      "device": "Y 相对定位距离",
      "address": "%QW4"
    },
    {
      "name": "rel_z_d",
      "dir": "input",
      "type": "INT",
      "range": [
        -100,
        100
      ],
      "unit": "%",
      "device": "Z 相对定位距离",
      "address": "%QW5"
    },
    {
      "name": "x_err_id",
      "dir": "output",
      "type": "INT",
      "range": [
        0,
        3
      ],
      "device": "X MC 块 ErrorID（0=无 1=越程 2=轴故障 3=未使能）",
      "address": "%QW16"
    },
    {
      "name": "y_err_id",
      "dir": "output",
      "type": "INT",
      "range": [
        0,
        3
      ],
      "device": "Y MC 块 ErrorID",
      "address": "%QW17"
    },
    {
      "name": "z_err_id",
      "dir": "output",
      "type": "INT",
      "range": [
        0,
        3
      ],
      "device": "Z MC 块 ErrorID",
      "address": "%QW18"
    }
  ],
  "axes": [
    {
      "axis": "x_axis",
      "type": "linear",
      "stroke": [
        0.0,
        100.0
      ],
      "unit": "%",
      "limits": {
        "vmax": 40.0,
        "accel": 80.0
      },
      "defaults": {
        "velocity": 40.0,
        "acceleration": 80.0,
        "deceleration": 80.0
      },
      "poswin": 2.0,
      "io": {
        "fb": "x_fb",
        "sp": "x_sp",
        "sw": "x_sw",
        "v": "x_v",
        "rel_d": "rel_x_d",
        "err_id": "x_err_id"
      }
    },
    {
      "axis": "y_axis",
      "type": "linear",
      "stroke": [
        0.0,
        100.0
      ],
      "unit": "%",
      "limits": {
        "vmax": 40.0,
        "accel": 80.0
      },
      "defaults": {
        "velocity": 40.0,
        "acceleration": 80.0,
        "deceleration": 80.0
      },
      "poswin": 2.0,
      "io": {
        "fb": "y_fb",
        "sp": "y_sp",
        "sw": "y_sw",
        "v": "y_v",
        "rel_d": "rel_y_d",
        "err_id": "y_err_id"
      }
    },
    {
      "axis": "z_axis",
      "type": "linear",
      "stroke": [
        0.0,
        100.0
      ],
      "unit": "%",
      "limits": {
        "vmax": 40.0,
        "accel": 80.0
      },
      "defaults": {
        "velocity": 40.0,
        "acceleration": 80.0,
        "deceleration": 80.0
      },
      "poswin": 2.0,
      "io": {
        "fb": "z_fb",
        "sp": "z_sp",
        "sw": "z_sw",
        "v": "z_v",
        "rel_d": "rel_z_d",
        "err_id": "z_err_id"
      }
    }
  ],
  "constraints": [
    {
      "id": "C1",
      "kind": "interlock",
      "desc": "快停优先于使能：MC_Stop 生效期间 MC_Power 禁止发使能命令；释放后自动重新上电序列"
    },
    {
      "id": "C2",
      "kind": "interlock",
      "desc": "非 OE 状态电机速度指令必须为零（伺服环仅在 OE/QSA/FRA 输出，后者走减速曲线）；全程速度限幅 ±120"
    },
    {
      "id": "C3",
      "kind": "timing",
      "desc": "主站时序：目标位置寄存器先于 cmd_go 上升沿建立（≥1 扫描周期），否则驱动锁存旧值"
    },
    {
      "id": "C4",
      "kind": "exception",
      "desc": "目标越程（<0 或 >100）触发故障反应：受控减速 → FA 状态，需 MC_Reset 复位后重新使能"
    }
  ],
  "acceptance": [
    {
      "id": "AC1",
      "desc": "使能后 0.5s 内三轴进入 Operation Enabled",
      "type": "event_delay",
      "from": {
        "signal": "run",
        "edge": "rising"
      },
      "to": {
        "signal": "all_oe",
        "edge": "rising"
      },
      "op": "<=",
      "value": 0.5,
      "unit": "s"
    },
    {
      "id": "AC2",
      "desc": "快停期间禁止运动（安全联锁）",
      "type": "forbidden_state",
      "when": {
        "signal": "quickstop",
        "equals": true
      },
      "forbid": {
        "signal": "any_moving",
        "equals": true
      }
    },
    {
      "id": "AC3",
      "desc": "故障未复位期间禁止运动",
      "type": "forbidden_state",
      "when": {
        "signal": "fault_any",
        "equals": true
      },
      "forbid": {
        "signal": "any_moving",
        "equals": true
      }
    },
    {
      "id": "AC4",
      "desc": "三轴定位精度：到位后各轴 |编码器-目标| ≤ 3（含伺服滞后）",
      "type": "region_containment",
      "asset": "gantry_head",
      "region_center": [
        0,
        0,
        0
      ],
      "tolerance": 3,
      "check_at": "end"
    },
    {
      "id": "AC5",
      "desc": "仿真无发散、轴行程未越界（0~100）",
      "type": "sim_health"
    }
  ]
}